{
  "contractVersion": "2026-06-issue-175-phase-1",
  "generatedAt": "2026-06-27T23:15:29.693Z",
  "organization": {
    "logtoOrganizationId": "org_demo",
    "name": "Colegio Demo",
    "profileId": "prof_1",
    "sourceAnchors": {
      "logtoOrganizationId": "org_demo"
    }
  },
  "summary": {
    "status": "expected_missing_user",
    "severity": "info",
    "humanMessage": "Falta usuario WordPress y es esperado hasta primer login.",
    "dominantSource": "live_provider_check",
    "nextAction": "wait_first_wordpress_login",
    "availableActions": [
      "wait_first_wordpress_login",
      "verify_provider",
      "none"
    ]
  },
  "canonical": {
    "status": "ok",
    "severity": "success",
    "humanMessage": "Logto confirmado.",
    "providerCode": null,
    "providerStatus": "ok",
    "nextAction": "none",
    "availableActions": [
      "none"
    ],
    "freshness": {
      "source": "live_provider_check",
      "checkedAt": "2026-06-27T00:00:00.000Z",
      "staleAfterSeconds": 120,
      "isStale": true,
      "shouldAutoRefresh": true,
      "refreshReason": "live_provider_check_stale"
    },
    "invalidation": {
      "invalidateOnOperationIds": [],
      "invalidateOnStatuses": [
        "queued",
        "running",
        "completed",
        "failed",
        "partial_failed"
      ],
      "invalidatedAt": null,
      "lastEventId": "evt_1"
    },
    "details": {}
  },
  "fluentcrm": {
    "status": "linked",
    "severity": "success",
    "humanMessage": "Company FluentCRM enlazada.",
    "providerCode": null,
    "providerStatus": "linked",
    "nextAction": "verify_provider",
    "availableActions": [
      "verify_provider"
    ],
    "freshness": {
      "source": "local_reconciled",
      "checkedAt": "2026-06-27T00:00:00.000Z",
      "staleAfterSeconds": 300,
      "isStale": true,
      "shouldAutoRefresh": false,
      "refreshReason": "local_reconciled_stale"
    },
    "invalidation": {
      "invalidateOnOperationIds": [],
      "invalidateOnStatuses": [
        "queued",
        "running",
        "completed",
        "failed",
        "partial_failed"
      ],
      "invalidatedAt": null,
      "lastEventId": "evt_1"
    },
    "details": {}
  },
  "wordpress": {
    "status": "expected_missing_user",
    "severity": "info",
    "humanMessage": "Falta usuario WordPress y es esperado hasta primer login.",
    "providerCode": null,
    "providerStatus": "awaiting_first_wordpress_login",
    "nextAction": "wait_first_wordpress_login",
    "availableActions": [
      "wait_first_wordpress_login",
      "verify_provider"
    ],
    "freshness": {
      "source": "live_provider_check",
      "checkedAt": "2026-06-27T00:00:00.000Z",
      "staleAfterSeconds": 120,
      "isStale": true,
      "shouldAutoRefresh": true,
      "refreshReason": "live_provider_check_stale"
    },
    "invalidation": {
      "invalidateOnOperationIds": [],
      "invalidateOnStatuses": [
        "queued",
        "running",
        "completed",
        "failed",
        "partial_failed"
      ],
      "invalidatedAt": null,
      "lastEventId": "evt_1"
    },
    "details": {}
  },
  "worker": {
    "status": "ready",
    "severity": "success",
    "humanMessage": "Worker listo.",
    "providerCode": null,
    "providerStatus": "ready",
    "nextAction": "verify_provider",
    "availableActions": [
      "verify_provider"
    ],
    "freshness": {
      "source": "worker_runtime",
      "checkedAt": "2026-06-27T00:00:00.000Z",
      "staleAfterSeconds": 30,
      "isStale": true,
      "shouldAutoRefresh": true,
      "refreshReason": "worker_runtime_stale"
    },
    "invalidation": {
      "invalidateOnOperationIds": [],
      "invalidateOnStatuses": [
        "queued",
        "running",
        "completed",
        "failed",
        "partial_failed"
      ],
      "invalidatedAt": null,
      "lastEventId": "evt_1"
    },
    "details": {}
  },
  "liveVerification": {
    "status": "awaiting_first_wordpress_login",
    "severity": "info",
    "humanMessage": "Proveedor indica esperar primer login.",
    "providerCode": null,
    "providerStatus": "awaiting_first_wordpress_login",
    "nextAction": "wait_first_wordpress_login",
    "availableActions": [
      "wait_first_wordpress_login",
      "verify_provider"
    ],
    "freshness": {
      "source": "live_provider_check",
      "checkedAt": "2026-06-27T00:00:00.000Z",
      "staleAfterSeconds": 120,
      "isStale": true,
      "shouldAutoRefresh": true,
      "refreshReason": "live_provider_check_stale"
    },
    "invalidation": {
      "invalidateOnOperationIds": [],
      "invalidateOnStatuses": [
        "queued",
        "running",
        "completed",
        "failed",
        "partial_failed"
      ],
      "invalidatedAt": null,
      "lastEventId": "evt_1"
    },
    "details": {}
  },
  "contactProgress": {
    "status": "completed",
    "severity": "success",
    "humanMessage": "Contactos sincronizados.",
    "providerCode": null,
    "providerStatus": "completed",
    "nextAction": "verify_provider",
    "availableActions": [
      "verify_provider"
    ],
    "freshness": {
      "source": "local_reconciled",
      "checkedAt": "2026-06-27T00:00:00.000Z",
      "staleAfterSeconds": 300,
      "isStale": true,
      "shouldAutoRefresh": false,
      "refreshReason": "local_reconciled_stale"
    },
    "invalidation": {
      "invalidateOnOperationIds": [],
      "invalidateOnStatuses": [
        "queued",
        "running",
        "completed",
        "failed",
        "partial_failed"
      ],
      "invalidatedAt": null,
      "lastEventId": "evt_1"
    },
    "details": {}
  },
  "polling": {
    "shouldPoll": true,
    "intervalSeconds": 30,
    "reason": "stale_live_or_worker_block",
    "activeOperationIds": []
  },
  "latestEventIds": {
    "audit": "evt_3"
  },
  "compatibility": {}
}
